color,part,quantity,part_id
Dark Pink,"Clikits Icon, Square 2 x 2 Small with Pin",4,clikits015
Glitter Trans-Dark Pink,"Clikits Flexy Film, Star 3 x 3",2,clikits061
Trans-Dark Pink,"Clikits Icon, Star 2 x 2 Large with Pin, Silver Star Cutout Print",2,clikits006pb04
Trans-Light Purple,"Clikits Hair Clip Plastic, Grip, 5 Teeth per Side",1,51027
Trans-Light Purple,Clikits Hair Comb with 4 Holes,1,51034
Trans-Purple,"Clikits Icon, Square 2 x 2 Large with Pin, Silver Square with Cutout and Offset Small Silver Square Print",2,clikits016pb05
Trans-Purple,"Clikits Icon, Star 2 x 2 Small with Pin",4,clikits013
