color,part,quantity,part_id
Dark Red,Large Figure Claw with Ball Joint Socket (Ben 10),2,87837
Dark Red,"Large Figure Foot, Clawed with Ball Joint Socket (Ben 10)",2,87844
Dark Red,Large Figure Torso Skeletal with Ball Joints (Ben 10),1,89469
Red,Large Figure Arm / Leg Section with 2 Ball Joint Sockets (Ben 10),4,87839
Red,Large Figure Arm / Leg Section with 2 Ball Joints (Ben 10),4,87840
Red,Large Figure Head Modified Ben 10 Jet Ray with Yellow Brow Print,1,88520
Red,Large Figure Tail (Ben 10),1,87846
Yellow,"Large Figure Wing, Flexible with Lightning Bolts and 3 Axles (Ben 10)",1,87845
