color,part,quantity,part_id
Dark Bluish Gray,Bionicle Foot with Ball Joint Socket with Flat Top 3 x 6 x 2 1/3,2,62386
Dark Bluish Gray,"Bionicle Matoran Torso, Av-Matoran Type 1",1,60894
Dark Bluish Gray,"Technic, Axle Connector 2 x 3 with Ball Socket, Closed Sides, Squared Ends",2,60176
Pearl Light Gray,Bionicle Engine Jet Pack (Toa Lewa),1,60990
Pearl Light Gray,Bionicle Weapon Small Blade (Hewkii Mahri / Solek),2,57543
Trans-Neon Green,Bionicle Head Connector Block (Av-Matoran),1,60901
White,Bionicle Arm / Leg Upper Section (Solek),4,60900
White,Bionicle Mask Solek,1,60904
