color,part,quantity,part_id
Green,"Plant, Tree Flat Bush painted with hollow base",2,ftbushh
Green,"Plant, Tree Flat Fruit painted with hollow base",2,ftfruith
Green,"Plant, Tree Flat Pine painted with hollow base",2,ftpineh
White,Antenna with Side Spokes,1,3144
White,Brick 1 x 6 with Black 'TAXI' Thick Print,1,3009pb002
White,Brick 1 x 6 with Blue HOTEL Print,1,3009p04
White,Brick 1 x 6 with Red Rounded 'Shell' Print,1,3009pt1
White,"Flag on Flagpole, Wave with Denmark Print",1,777p03
